BRANDS SOLD,PRODUCT TYPES/ CATEGORIES,RETAILER TYPE,RETAILER_ID,RETAILER NAME,LOCATION NAME,ADDRESS,LAND MARK,CITY,DISTRICT,STATE/PROVINCE,ZIP/POSTAL CODE,COUNTRY,CONTACT PHONE,CONTACT PERSON,STORE SIZE,GEO COORDINATES,TIER LEVEL OF GOODS SOLD,URL,NUMBER OF STORES/BRANCHIES IN THE CHAIN,HQ ADDRESS,HOLDING COMPANY NAME,HOLDING COMPANY ADDRESS,HOLDINGS CONTACT,URL (HOLDING COMAPANY),MANUFACTURER / FACTORY,MANUFACTURER ADDRESS,MANUFACTURER CONTACT
,TV,Consumer Electronics,,BAJAJ ELECTRONICS,GUNTUR,"GUNTUR 5-87-45/A, 5/1, Guntur Village, Lakshmi Purma Main Road, Chandra Mouli,  Guntur, Andhra Pradesh - 522007",,Guntur,, Andhra Pradesh  ,522007,India,,,,,,https://www.bajajelectronics.com/stores,,,,,,,,,
,TV,Consumer Electronics,,BAJAJ ELECTRONICS,RAJAHMUNDRY,"RAJAHMUNDRY Door No 36-11-3, 4, 5, 6, Sabbavarapuvari Street, Rajamahendravaram, Rajahmundry, Andhra Pradesh - 533101",,,,Andhra Pradesh  ,533101,India,,,,,,https://www.bajajelectronics.com/stores,,,,,,,,,
,TV,Consumer Electronics,,BAJAJ ELECTRONICS,VIJAYAWADA BANDAR ROAD,"VIJAYAWADA BANDAR ROAD 54-15-1, R S No:394-4A, Ring Road. Vijayawada, Andhra Pradesh - ",,,,Andhra Pradesh  ,,India,,,,,,https://www.bajajelectronics.com/stores,,,,,,,,,
,TV,Consumer Electronics,,BAJAJ ELECTRONICS,VIJAYAWADA ELURU ROAD,"VIJAYAWADA ELURU ROAD Meenakshi Towers, 29-37-22, Eluru Rd, Surya Rao Pet, Vijayawada, Krishna, Andhra Pradesh - 520002,",,Andhra Pradesh  ,,,520002,India,,,,,,https://www.bajajelectronics.com/stores,,,,,,,,,
,TV,Consumer Electronics,,BAJAJ ELECTRONICS,VIZAG,"VIZAG 46/5/30/A, 46/15/30/b, Block No 22, Ward No.31, Dondaparthi Area, Near Diamond Park. Visakhapatnam.  Vizag. Andhra Pradesh - 530003", Near Diamond Park. Visakhapatnam. ,,,Vizag. Andhra Pradesh  ,530003,India,,,,,,https://www.bajajelectronics.com/stores,,,,,,,,,
,TV,Consumer Electronics,,BAJAJ ELECTRONICS,TIRUPATI - 1,"TIRUPATI - 1 15-1-66, G Car Street Near Nalugu Kalla Mandapam, Tirupati Andhra Pradesh - 517501"," 15-1-66, G Car Street Near Nalugu",,,Andhra Pradesh  ,517501,India,,,,,,https://www.bajajelectronics.com/stores,,,,,,,,,
,TV,Consumer Electronics,,BAJAJ ELECTRONICS,TIRUPATI - 2,"TIRUPATI - 2 18-2-263/12A Tirumala By Pass Road Near Leela Mahal Cross Road TIrupatl,  Andhra Pradesh - 517501", Near Leela Mahal Cross,,,Andhra Pradesh  ,517501,India,,,,,,https://www.bajajelectronics.com/stores,,,,,,,,,
,TV,Consumer Electronics,,BAJAJ ELECTRONICS,NELLORE,"NELLORE Door no 24-2-382, opp Kasturi Devi, School, Dargamett, SVSR Nellore-524003"," Door no 24-2-382, opp Kasturi Devi,",,,Nellore,524003,India,,,,,,https://www.bajajelectronics.com/stores,,,,,,,,,
,TV,Consumer Electronics,,BAJAJ ELECTRONICS,ABIDS,"ABIDS House No. 5-4-17, Jr. Road, Abids  Hyderabad, Telangana -500001",,Hyderabad,, Telangana ,500001,India,,,,,,https://www.bajajelectronics.com/stores,,,,,,,,,
,TV,Consumer Electronics,,BAJAJ ELECTRONICS,ATTAPUR,"ATTAPUR Pillar No.138. Survey.no 400, One Plaza, Attapur, Rajendra Nagar, R.R. Dist, Hyderabad, Telangana - 500048",,,,Telangana  ,500048,India,,,,,,https://www.bajajelectronics.com/stores,,,,,,,,,
,TV,Consumer Electronics,,BAJAJ ELECTRONICS,"BAJAJ MALL, PANJAGUTTA","BAJAJ MALL, PANJAGUTTA Shop No 6-3-669, Ground Floor, Ozone Complex Panjagutta, Hyderabad, Telangana - 500072",,Hyderabad,, Telangana  ,500072,India,,,,,,https://www.bajajelectronics.com/stores,,,,,,,,,
,TV,Consumer Electronics,,BAJAJ ELECTRONICS,BANJARA HILLS,"BANJARA HILLS D.no:- 8-2-672/b. road No:1, Banjara Hills, Hyderabad, Telangana - 500034",, Hyderabad,, Telangana  ,500034,India,,,,,,https://www.bajajelectronics.com/stores,,,,,,,,,
,TV,Consumer Electronics,,BAJAJ ELECTRONICS,HAYATHNAGAR,"HAYATHNAGAR Door No 4-7-104. Opp. Hayathnagar  Police Station, R.R. Dist, Hyderabad, Telangana - 501505", Door No 4-7-104. Opp. Hayathnagar ,,,Telangana  ,501505,India,,,,,,https://www.bajajelectronics.com/stores,,,,,,,,,
,TV,Consumer Electronics,,BAJAJ ELECTRONICS,KARIMNAGAR,"KARIMNAGAR Doctor Bv. Reddy Complex, Municipal No 2-3-180 Kaman Road, Karimnagar, Telangana - 505405",,,,Telangana  ,505405,India,,,,,,https://www.bajajelectronics.com/stores,,,,,,,,,
,TV,Consumer Electronics,,BAJAJ ELECTRONICS,KHAMMAM,"KHAMMAM 9-5-10/1, kasba Bazar, Khammam, Telangana - 507001",,,,Telangana  ,507001,India,,,,,,https://www.bajajelectronics.com/stores,,,,,,,,,
,TV,Consumer Electronics,,BAJAJ ELECTRONICS,RAMANTHAPUR,"RAMANTHAPUR Door No 3-80 (old), 4-117 (new) & 2-80 (old). 4-118(new) Opp Hyderabad Public School, Uppal Main Road, Ramanthapur, R.R. Dist Hyderabad, Telangana 500013 ", (old). 4-118(new) Opp Hyderabad,,,Telangana  ,500013,India,,,,,,https://www.bajajelectronics.com/stores,,,,,,,,,
,TV,Consumer Electronics,,BAJAJ ELECTRONICS,RC PURAM,"RC PURAM D.no. 22-95/1 & 22-95/2, Plot No 3 & 4, Survey No. 212, Main Road, Ramchandrapuram, Medak Dist, Hyderabad. Telangana - 502032",,,,Hyderabad. Telangana  ,502032,India,,,,,,https://www.bajajelectronics.com/stores,,,,,,,,,
,TV,Consumer Electronics,,BAJAJ ELECTRONICS,BHEL,"BHEL D No.2-51/1 Br Naidu Castle, Chandanagar Main Road, Bhel, Medak Dist Hyderabad, Telangana - 500050",,,,Telangana  ,500050,India,,,,,,https://www.bajajelectronics.com/stores,,,,,,,,,
,TV,Consumer Electronics,,BAJAJ ELECTRONICS,BODUPPAL,"BODUPPAL 1-10-3, Om Vihar Colony, Main Road, Warangal High Way, Medipally (v), Boduppal, R.R. Dist, Hyderabad, Telangana - 500039",,,,Telangana  ,500039,India,,,,,,https://www.bajajelectronics.com/stores,,,,,,,,,
,TV,Consumer Electronics,,BAJAJ ELECTRONICS,CHIKKADPALLY,"CHIKKADPALLY Mch No 1-8-558, Beside Big Bazar, Rtc ' X' Roads, Chikkadpally, Hyderabad, Telangana - 500020",,Hyderabad,, Telangana  ,500020,India,,,,,,https://www.bajajelectronics.com/stores,,,,,,,,,
,TV,Consumer Electronics,,BAJAJ ELECTRONICS,CHINTAL,"CHINTAL D.no. 60-009/8/4, Idp1 Center Beside Indian 011 Petrol Bunk, Chintal, Quthbullapur (v), R R Dist, Hyderabad, Telangana - 500037 ",,Hyderabad,, Telangana   ,500037,India,,,,,,https://www.bajajelectronics.com/stores,,,,,,,,,
,TV,Consumer Electronics,,BAJAJ ELECTRONICS,DILSUKHNAGAR,"DILSUKHNAGAR H no.16-11-477/3/2, Plot No 31, Ground Floor C.I. Reddy Complex, Opp Kamala Hospital. Dilsukhnagar, Hyderabad, Telangana - 500036"," Opp Kamala Hospital. Dilsukhnagar,",Hyderabad,, Telangana  ,500036,India,,,,,,https://www.bajajelectronics.com/stores,,,,,,,,,
,TV,Consumer Electronics,,BAJAJ ELECTRONICS,DSNR-SAMSUNG MOBILE CAFE,"DSNR-SAMSUNG MOBILE CAFE H.no.16-11-477/3/2. Plot No. 31, Ground Floor C.I. Reddy Complex, Opp Kamala Hospital, DlIsukhnagar, Hyderabad, Telangana - 500036"," Opp Kamala Hospital, DlIsukhnagar,",Hyderabad,, Telangana  ,500036,India,,,,,,https://www.bajajelectronics.com/stores,,,,,,,,,
,TV,Consumer Electronics,,BAJAJ ELECTRONICS,ECIL,"ECIL Plot 17 Kamalanagar, Ecil X Road Opp Saibaba Temple, Ecil, R.R. Dist, Hyderabad, Telangana - 500062"," Plot 17 Kamalanagar, Ecil X Road Opp",Hyderabad,, Telangana  ,500062,India,,,,,,https://www.bajajelectronics.com/stores,,,,,,,,,
,TV,Consumer Electronics,,BAJAJ ELECTRONICS,FORUM MALL,"FORUM MALL 3rd Floor, Plot No S-16, Survey No 1009, k.p.h.b. Phase 6, Opp. Malaysian Township, Kukatpally. Hyderabad, Telangana-500072"," 1009, k.p.h.b. Phase 6, Opp.",Hyderabad,, Telangana,500072,India,,,,,,https://www.bajajelectronics.com/stores,,,,,,,,,
,TV,Consumer Electronics,,BAJAJ ELECTRONICS,FORUM MALL - SAMSUNG,"FORUM MALL - SAMSUNG Plot No S-16 Survey No.1009, Shop No 311 To 315 3rd Floor Kphb, Kukkatpally, Medchal Dist, Hyderabad, Telangana - 500072",,Hyderabad,, Telangana  ,500072,India,,,,,,https://www.bajajelectronics.com/stores,,,,,,,,,
,TV,Consumer Electronics,,BAJAJ ELECTRONICS,FORUM MALL - LG SHOP,"FORUM MALL - LG SHOP Plot No. S-16 Survey No 1009, Shop No. 311 To 315 3rd Floor, Kphb, Kukkatpally, Medchal Dist, Hyderabad, Telangana - 500072",,Hyderabad,, Telangana  ,500072,India,,,,,,https://www.bajajelectronics.com/stores,,,,,,,,,
,TV,Consumer Electronics,,BAJAJ ELECTRONICS,HABSIGUDA,"HABSIGUDA 1-4-44/4 & 1-4-44/4/a, Street No.8, Habsiguda, Hyderabad, Telangana - 500007",,,,Telangana  ,500007,India,,,,,,https://www.bajajelectronics.com/stores,,,,,,,,,
,TV,Consumer Electronics,,BAJAJ ELECTRONICS,JUBILEE HILLS,"JUBILEE HILLS Plot No.722, Road No.36, Pemmasani Complex, Near Madhapur Police Station, Jubilee Hills, Hyderabad, Telangana - 500033"," Pemmasani Complex, Near Madhapur",Hyderabad,, Telangana  ,500033,India,,,,,,https://www.bajajelectronics.com/stores,,,,,,,,,
,TV,Consumer Electronics,,BAJAJ ELECTRONICS,KARMANGHAT,"KARMANGHAT Plot No 40 41, 42 & 43. Sagar Road, karmanghat, R.R. Dist Hyderabad, Telangana - 500079",,,,Telangana  ,500079,India,,,,,,https://www.bajajelectronics.com/stores,,,,,,,,,
,TV,Consumer Electronics,,BAJAJ ELECTRONICS,KOMPALLY,"KOMPALLY H.no. 04-009/nr, (old No - 3-24), Survey No 43, Near Suchitra Circle, Kompally, R.R Dist, Hyderabad, Telangana -500014"," Survey No 43, Near Suchitra Circle,",,,Telangana ,500014,India,,,,,,https://www.bajajelectronics.com/stores,,,,,,,,,
,TV,Consumer Electronics,,BAJAJ ELECTRONICS,KONDAPUR,"KONDAPUR Plot No 3 & 4 Part Sy.no 19, Kothaguda (v), Kondapur 'x' Roads, Serilingampally (m), R.R. Dist, Hyderabad,Telangana - 500084",,Hyderabad,,Telangana  ,500084,India,,,,,,https://www.bajajelectronics.com/stores,,,,,,,,,
,TV,Consumer Electronics,,BAJAJ ELECTRONICS,KOTHAPET,"KOTHAPET 11-13-1376/4, Pinnacle One Complex, Dwarakapuri Colony, Beside More Mega Stores, Saroornagar, R.R. Dist, Hyderabad. Telangana -500035",,,,Hyderabad. Telangana ,500035,India,,,,,,https://www.bajajelectronics.com/stores,,,,,,,,,
,TV,Consumer Electronics,,BAJAJ ELECTRONICS,KOTI,"KOTI Shop 36 N 37 Michila Complex Bank Street Koti, Hyderabad, Ranga Reddy, Telangana - 500095",,,,Telangana  ,500095,India,,,,,,https://www.bajajelectronics.com/stores,,,,,,,,,
,TV,Consumer Electronics,,BAJAJ ELECTRONICS,KUKATPALLY,"KUKATPALLY 15-31-83, Plot No 3 Mig 3. Phase I Dharma Reddy Colony Near Hdfc Bank, Kphb, Kukatpally, Hyderabad. Telangana - 500072", Dharma Reddy Colony Near Hdfc,,,Telangana  ,500072,India,,,,,,https://www.bajajelectronics.com/stores,,,,,,,,,
,TV,Consumer Electronics,,BAJAJ ELECTRONICS,LAKDIKAPUL,"LAKDIKAPUL 6-1-91/10,11, Near Telephone Bhavan, Lakdikapul, Hyderabad, Telangana-500004 "," 6-1-91/10,11, Near Telephone Bhavan,",,,Telangana ,500004,India,,,,,,https://www.bajajelectronics.com/stores,,,,,,,,,
,TV,Consumer Electronics,,BAJAJ ELECTRONICS,MADINAGUDA,"MADINAGUDA 1-58/fh/1 To 5, Survey No 225, Fortune Heights, Madinaguda, Miyapur Main Road. Hyderabad, Telangana - 500049",,,,Telangana  ,500049,India,,,,,,https://www.bajajelectronics.com/stores,,,,,,,,,
,TV,Consumer Electronics,,BAJAJ ELECTRONICS,MALAKPET,"MALAKPET 16-2-681/a5, Mamta Complex, Main Road New Malakpet, Hyderabad, Telangana - 500036",,,,Telangana  ,500036,India,,,,,,https://www.bajajelectronics.com/stores,,,,,,,,,
,TV,Consumer Electronics,,BAJAJ ELECTRONICS,MG ROAD,"MG ROAD Door No.1-7-178,182 To 184 M.g.road, Paradise Circle ,secunderabad, Telangana - 500003",,,,Telangana  ,500003,India,,,,,,https://www.bajajelectronics.com/stores,,,,,,,,,
,TV,Consumer Electronics,,BAJAJ ELECTRONICS,NACHARAM,"NACHARAM D no 4-7-40/3, Plot No. A-131 Part, Nacharam, R R Dist, Hyderabad, Telangana- 500040 ",,,,Telangana  ,500040,India,,,,,,https://www.bajajelectronics.com/stores,,,,,,,,,
,TV,Consumer Electronics,,BAJAJ ELECTRONICS,NAGOLE,"NAGOLE D No 2-3-260 & 266,plot No 7 & 7(p), Sri Sai Ram Complex, Opp. Honda Showroom, Nagole, R.R. Dist, Hyderabad. Telangana-500068"," Sri Sai Ram Complex, Opp. Honda",,,Hyderabad. Telangana,500068,India,,,,,,https://www.bajajelectronics.com/stores,,,,,,,,,
,TV,Consumer Electronics,,BAJAJ ELECTRONICS,NALLAKUNTA,"NALLAKUNTA D No 2-1-520 To 526/2, Vijaya Sri Sai Celestia Complex, Nallakunta, Hyderabad, Telangana -500044",,Hyderabad,, Telangana ,500044,India,,,,,,https://www.bajajelectronics.com/stores,,,,,,,,,
,TV,Consumer Electronics,,BAJAJ ELECTRONICS,NIZAMPET,"NIZAMPET Plot No. 1&2, Shop No 3&4, Panchsheel Complex, Beside Domino's Pizza, Nizampet, R.R Dist Hyderabad, Telangana - 500090",,Hyderabad,, Telangana  ,500090,India,,,,,,https://www.bajajelectronics.com/stores,,,,,,,,,
,TV,Consumer Electronics,,BAJAJ ELECTRONICS,L.G. BEST SHOP,"L.G. BEST SHOP H.no. 6-3-347/6/p/3 & 4, Sai Baba Temple Road, Dwarakapuri Colony, Panjagutta, Hyderabad, Telangana - 500082",,,,Telangana  ,500082,India,,,,,,https://www.bajajelectronics.com/stores,,,,,,,,,
,TV,Consumer Electronics,,BAJAJ ELECTRONICS,SDH,"SDH 6-3-456/c , Ground Floor , MGR Estate, Dwaraka Puri Colony, Punjagutta, R R Dist Hyderabad, Telangana - 500082",,,,Telangana  ,500082,India,,,,,,https://www.bajajelectronics.com/stores,,,,,,,,,
,TV,Consumer Electronics,,BAJAJ ELECTRONICS,VANASTHALIPURAM,"VANASTHALIPURAM Plot No 4, Survey No 58 To 68, Vanasthalipuram, Beside Indian Oil Petrol Bunk, Hayathnagar, R.R. Dist, Hyderabad, Telangana - 500070",,Hyderabad,, Telangana  ,500070,India,,,,,,https://www.bajajelectronics.com/stores,,,,,,,,,
,TV,Consumer Electronics,,BAJAJ ELECTRONICS,TOLICHOWKI,"TOLICHOWKI D.no 8-1-364/1&2, Near Galaxy Theater, Tolichowki, Hyderabad, Telangana -500008"," D.no 8-1-364/1&2, Near Galaxy",,,Telangana ,500008,India,,,,,,https://www.bajajelectronics.com/stores,,,,,,,,,
,TV,Consumer Electronics,,BAJAJ ELECTRONICS,WARANGAL,"WARANGAL H.no. 2-5-34,35 & 35/1, Nakkalgutta, Hanamkonda, Warangal, Telangana-506001",,,,Telangana,506001,India,,,,,,https://www.bajajelectronics.com/stores,,,,,,,,,
,TV,Consumer Electronics,,BAJAJ ELECTRONICS,GACHIBOWLI,"GACHIBOWLI Plot No 77/p, 8 & 15 Gachibowli, R.R. Dist, Hyderabad, Telangana - 500032",,,,Telangana  ,500032,India,,,,,,https://www.bajajelectronics.com/stores,,,,,,,,,
,TV,Consumer Electronics,,BAJAJ ELECTRONICS,A S RAO NAGAR,"A S RAO NAGAR D.no 1-12-188/14, plot No.lig-b14, Manikonda Plaza Dr.a.s Rao Nagar, Kapra, R.R. Dist, Hyderabad, Telangana - 500062",,,,Telangana  ,500062,India,,,,,,https://www.bajajelectronics.com/stores,,,,,,,,,
,TV,Consumer Electronics,,BAJAJ ELECTRONICS,MAHBUBNAGAR,"MAHBUBNAGAR 1-5-91/1, New Town, Mahbubnagar, Telangana - 509001, mahaboobnagar@bajajelectronics.in,",,mahaboobnagar@bajajelectronics.in,,,,India,,,,,,https://www.bajajelectronics.com/stores,,,,,,,,,
,TV,Consumer Electronics,,BAJAJ ELECTRONICS,MIYAPUR,"MIYAPUR Plot NO. 134, Jyoti Plaza, Ground Floor, Mathushree Nagar, MIYAPUR-500049 miyapur@bajajelectronics.in,",,miyapur@bajajelectronics.in,,,,India,,,,,,https://www.bajajelectronics.com/stores,,,,,,,,,
